{
  "target_artifacts": [
    "course/lesson01/through/course/lesson10/",
    "output/requirements.json",
    "output/learning-plan.json"
  ],
  "criteria_checked": [
    "给定一个空白HTML文件,能独立写出包含DOCTYPE/html/head/body/title/meta的完整文档骨架",
    "给定一组项目信息(标题/描述/截图),能用section/article/ul/li语义化标签构建项目展示区",
    "给定联系需求(姓名/邮箱/留言),能用form/input/textarea/button/label独立编写可提交的联系表单",
    "给定已完成的作品集HTML文件,能使用GitHub Pages将其部署为可公开访问的在线网站"
  ],
  "findings": [
    {
      "artifact": "course/lesson01/in_class/practice05.py",
      "criterion": "能独立写出包含DOCTYPE/html/head/body/title/meta的完整文档骨架",
      "verdict": "pass",
      "severity": "minor",
      "detail": "Day 1 练习 5 要求学员独立写完整 HTML 文档骨架,覆盖 DOCTYPE/html/head/body/title/meta。练习设计合理,参考答案正确。"
    },
    {
      "artifact": "course/lesson09/",
      "criterion": "能用section/article/ul/li语义化标签构建项目展示区",
      "verdict": "pass",
      "severity": "minor",
      "detail": "Day 9 项目展示页要求用 ul/li + img 做卡片列表,对应 section/article 语义化标签。notes.md 含 ASCII 内存图,练习覆盖卡片结构。"
    },
    {
      "artifact": "course/lesson10/",
      "criterion": "能用form/input/textarea/button/label独立编写可提交的联系表单",
      "verdict": "pass",
      "severity": "minor",
      "detail": "Day 10 联系表单页含 form/input/textarea/button/label 完整标签。input 类型 ASCII 图覆盖 text/email/tel/url/number/password/search/hidden 八种。"
    },
    {
      "artifact": "course/lesson10/homework/task03.py",
      "criterion": "能使用GitHub Pages将其部署为可公开访问的在线网站",
      "verdict": "partial",
      "severity": "major",
      "detail": "Day 10 部署步骤在 homework/task03.py 中有涉及,但 notes.md 中 GitHub Pages 部署步骤不够详细(缺少 git init / git push / 仓库设置的具体命令)。学员可能卡在'如何把 HTML 文件推到 GitHub'这一步。"
    }
  ],
  "structural_check": {
    "passed": true,
    "details": [
      "10 个 lesson 目录,每个含 README.md + notes.md + 6 practice + 3 task = 11 文件",
      "所有 practice 文件头含 [难度: ] [所属知识点: ] [预计完成时间: ]",
      "所有 task 文件头含 [类型: 选做]",
      "难度分布: ★×2 + ★★×2 + ★★★×2 per day(符合线性递进)",
      "notes.md 都含 8 步趁热打铁结构(痛点→类比→解释→ASCII→执行跟踪→常见错误→学员代码区→参考答案)"
    ]
  },
  "overall_verdict": "pass-with-minors",
  "recommended_action": {
    "type": "rebuild-lesson",
    "target": "lesson10(GitHub Pages 部署步骤不够详细,需补充 git 命令和仓库设置)"
  }
}
