{
  "target_artifacts": [
    "course/lesson01/through/course/lesson10/",
    "output/requirements.json",
    "output/learning-plan.json"
  ],
  "criteria_checked": [
    "给定一个空白HTML文件,能独立写出包含DOCTYPE/html/head/body/title/meta的完整文档骨架",
    "给定一组项目信息(标题/描述/截图),能用section/article/ul/li语义化标签构建项目展示区",
    "给定联系需求(姓名/邮箱/留言),能用form/input/textarea/button/label独立编写可提交的联系表单",
    "给定已完成的作品集HTML文件,能使用GitHub Pages将其部署为可公开访问的在线网站"
  ],
  "findings": [
    {
      "artifact": "course/lesson05/notes.md",
      "criterion": "能用form/input/textarea/button/label独立编写可提交的联系表单",
      "verdict": "partial",
      "severity": "major",
      "detail": "Day 5(表单基础)缺少'执行过程跟踪'段(8 步循环中的第 5 步)。其他 7 步(痛点/类比/解释/ASCII/常见错误/学员代码区/参考答案)均完整,唯独缺少执行跟踪。建议补全 form 提交过程的逐步跟踪。"
    },
    {
      "artifact": "course/lesson10/homework/task03.py",
      "criterion": "能使用GitHub Pages将其部署为可公开访问的在线网站",
      "verdict": "partial",
      "severity": "major",
      "detail": "Day 10 部署步骤在 homework/task03.py 中有涉及,但 notes.md 中 GitHub Pages 部署步骤不够详细。缺少具体命令(git init / git add / git commit / git push / 仓库设置),学员可能卡在'如何把 HTML 文件推到 GitHub'这一步。"
    },
    {
      "artifact": "course/lesson01/notes.md",
      "criterion": "能独立写出包含DOCTYPE/html/head/body/title/meta的完整文档骨架",
      "verdict": "pass",
      "severity": "minor",
      "detail": "Day 1 8 步循环完整,DOCTYPE 定义准确,代码示例可运行。"
    },
    {
      "artifact": "course/lesson09/",
      "criterion": "能用section/article/ul/li语义化标签构建项目展示区",
      "verdict": "pass",
      "severity": "minor",
      "detail": "Day 9 项目展示页 8 步完整,ul/li + img 卡片结构清晰,ASCII 内存图有助于理解。"
    }
  ],
  "structural_check": {
    "passed": true,
    "details": [
      "10 个 lesson 目录,每个含 README.md + notes.md + 6 practice + 3 task = 11 文件",
      "所有 practice 文件头含 [难度: ] [所属知识点: ] [预计完成时间: ]",
      "所有 task 文件头含 [类型: 选做]",
      "难度分布: ★×2 + ★★×2 + ★★★×2 per day(符合线性递进)",
      "8 步循环验证:抽查 Day 1/Day 5/Day 10,Day 1 完整(8/8),Day 5 缺执行跟踪(7/8),Day 10 完整(8/8)",
      "pedagogy 对照:Day 1 工具先行落地,Day 5 非 NCDL 节点(合理)",
      "学员视角:难度线性递增(★★→★★★→★★★★),类比来自已知经验"
    ]
  },
  "overall_verdict": "pass-with-minors",
  "recommended_action": {
    "type": "rebuild-lesson",
    "target": "lesson05(补执行跟踪)+lesson10(补 GitHub Pages 具体命令)"
  }
}
