{
  "target_artifacts": [
    "output/iter-R11-webscraping/requirements.json",
    "output/iter-R11-webscraping/learning-plan.json",
    "output/iter-R11-webscraping/course/lesson01/"
  ],
  "criteria_checked": [
    "能用'快递站'类比向新手解释爬虫(发送请求→接收响应→解析内容→存储数据)",
    "给定一个产品列表页 URL,能用 requests + BeautifulSoup 抓取产品名称和价格",
    "给定一个被反爬的网页,能诊断原因并给出至少 2 种解决方案"
  ],
  "findings": [
    {
      "artifact": "output/iter-R11-webscraping/requirements.json",
      "criterion": "能用'快递站'类比向新手解释爬虫",
      "verdict": "pass",
      "severity": "minor",
      "detail": "DISCOVER 产出聚焦(≤3 核心能力 + scope_out_of_v1),learner_persona 清晰,acceptance_criteria 覆盖 3 个认知层级,success_scenarios 具体,v1.1 改进全部应用。"
    },
    {
      "artifact": "output/iter-R11-webscraping/learning-plan.json",
      "criterion": "能用 requests + BeautifulSoup 抓取产品名称和价格",
      "verdict": "pass",
      "severity": "minor",
      "detail": "PLAN 的 DAG 教学法标注清晰(w4=ncdl),pedagogy_notes 每课都有,5 天课表 daily_hours 不溢出,pruning 4 项都有理由。"
    },
    {
      "artifact": "output/iter-R11-webscraping/course/lesson01/",
      "criterion": "给定一个产品列表页 URL,能用 requests + BeautifulSoup 抓取产品名称和价格",
      "verdict": "pass",
      "severity": "minor",
      "detail": "BUILD Day 1 8 步循环完整,第一个代码示例就能运行(工具先行),明日衔接段存在,文件后缀 .py 匹配 Python 环境。"
    }
  ],
  "structural_check": {
    "passed": true,
    "details": [
      "Day 1:README.md + notes.md + 6 practice.py + 3 task.py = 11 文件",
      "所有 practice 文件头含 [难度: ] [所属知识点: ] [预计完成时间: ]",
      "所有 task 文件头含 [类型: 选做]",
      "难度分布: ★×2 + ★★×2 + ★★★×2 per day(符合线性递进)",
      "8 步循环验证:Day 1 完整(8/8)",
      "pedagogy 对照:Day 1 工具落地,Day 4(未建)标 ncdl",
      "学员视角:难度线性递增,类比'快递站'来自已知经验"
    ]
  },
  "overall_verdict": "pass",
  "recommended_action": {
    "type": "ship",
    "target": "v1.1 skill 在 Web Scraping 新领域表现良好,可以继续建 Day 2-5"
  }
}
